<?xml version="1.0" encoding="UTF-8"?>
<tariff xmlns:tar="http://mobileoperator.com/schema/tariff"
        xmlns:base="http://mobileoperator.com/schema/base-types"
        xmlns:xsi="http://www.w3.org/2001/XMLSchema-instance"
        xsi:schemaLocation="http://mobileoperator.com/schema/tariff tariff.xsd">
    <id>f1e2d3c4-b5a6-9b8c-7d6e-5f4a3b2c1d0e</id>
    <name>С</name>
    <description>T</description>
    <monthlyFee>-10.00</monthlyFee>
    <internetLimit>-100</internetLimit>
    <callMinutes>1000</callMinutes>
    <smsLimit xsi:nil="true"/>
</tariff>